{
  "$schema": "http://json-schema.org/draft-07/schema#",
  "$id": "resumenes.schema.json",
  "title": "resumenes.json",
  "description": "Un solo archivo por período con los cinco resúmenes que antes iban sueltos (ids y los NPS/CSAT por carrera y por ciclo). Desde la versión 1.1 el archivo declara cada columna publicada en el bloque 'preguntas' (id, nombre, tipo y escala), la misma declaración que respuestas.json, sin el texto largo de la pregunta. Cada parte conserva su propio schema formal, que el validador aplica por separado.",
  "type": "object",
  "additionalProperties": false,
  "required": ["version", "ids", "nps_carrera", "csat_carrera", "nps_ciclo_carrera", "csat_ciclo_carrera"],
  "properties": {
    "version": {
      "type": "string",
      "description": "Versión del contrato. Desde 1.1 el archivo trae el bloque 'preguntas'; los 1.0 anteriores no lo llevan y siguen siendo válidos.",
      "enum": ["1.0", "1.1"]
    },
    "preguntas": {
      "description": "Declaración compacta de cada columna publicada: id estable, nombre publicado, tipo de columna y escala. Igual que la de respuestas.json del mismo período, sin el texto largo de la pregunta.",
      "type": "array",
      "minItems": 1,
      "items": {
        "type": "object",
        "additionalProperties": false,
        "required": ["id", "nombre", "tipo", "escala"],
        "properties": {
          "id": { "type": "string", "minLength": 1 },
          "nombre": { "type": "string", "minLength": 1 },
          "tipo": { "type": "string", "enum": ["medida", "agrupacion", "fecha", "identificador"] },
          "escala": { "type": "string" }
        },
        "if": { "properties": { "tipo": { "const": "medida" } }, "required": ["tipo"] },
        "then": { "properties": { "escala": { "minLength": 1 } } }
      }
    },
    "ids": {
      "type": "array",
      "description": "Conteo de respuestas por facultad, carrera y ciclo. Cada fila se valida contra ids.schema.json.",
      "items": { "type": "object" }
    },
    "nps_carrera": {
      "type": "array",
      "description": "NPS por carrera. Cada fila se valida contra nps_carrera.schema.json.",
      "items": { "type": "object" }
    },
    "csat_carrera": {
      "type": "array",
      "description": "CSAT por carrera. Cada fila se valida contra csat_carrera.schema.json.",
      "items": { "type": "object" }
    },
    "nps_ciclo_carrera": {
      "type": "array",
      "description": "NPS por ciclo y carrera. Puede ir vacía en las encuestas sin ciclos. Cada fila se valida contra nps_ciclo_carrera.schema.json.",
      "items": { "type": "object" }
    },
    "csat_ciclo_carrera": {
      "type": "array",
      "description": "CSAT por ciclo y carrera. Puede ir vacía en las encuestas sin ciclos. Cada fila se valida contra csat_ciclo_carrera.schema.json.",
      "items": { "type": "object" }
    }
  },
  "allOf": [
    {
      "if": { "properties": { "version": { "const": "1.1" } }, "required": ["version"] },
      "then": { "required": ["preguntas"] }
    }
  ]
}
